species,pocket,n_atoms,n_residues,mean_APBS_0p15M,median_APBS_0p15M,max_APBS_0p15M,fraction_positive,fraction_gt_50,fraction_gt_100,residue_list
TcS6_Q4DSU0,2,25,5,1146.491464,985.4726,2138.262,1.0,1.0,1.0,ARG230A; ARG231A; ASN227A; HIS234A; LYS235A
TcS6_Q4DSU0,11,23,6,1080.786595652174,922.4421,1955.401,1.0,1.0,1.0,ALA223A; ARG220A; ARG224A; ARG231A; ASN227A; SER228A
TcS6_Q4DSU0,5,18,5,872.1278333333335,782.9791,1806.905,1.0,1.0,1.0,ARG220A; ARG221A; ARG224A; GLN225A; GLY217A
Human_RPS6,12,15,4,598.1065533333332,602.768,923.5639,1.0,1.0,1.0,ARG231A; ARG238A; LEU234A; SER235A
Human_RPS6,9,19,5,606.0149263157896,578.1139,1285.297,1.0,1.0,1.0,ALA229A; ARG233A; GLU226A; LEU234A; LYS230A
TcS6_Q4DSU0,3,21,5,162.67613714285713,122.6978,360.7421,1.0,1.0,0.7142857142857143,ALA244A; GLN241A; GLY248A; LEU245A; LYS249A
TcS6_Q4DSU0,4,22,6,149.55825818181822,158.3977,228.7671,1.0,0.9545454545454546,0.8181818181818182,ALA244A; GLN239A; LEU243A; LYS240A; LYS247A; VAL236A
TcS6_Q4DSU0,14,16,4,200.739658125,210.64775,558.0755,0.8125,0.8125,0.8125,ARG203A; GLU200A; ILE199A; LYS196A
Human_RPS6,1,24,6,89.85119208333333,123.676,537.1443,0.7916666666666666,0.7916666666666666,0.5833333333333334,ALA193A; ARG189A; ILE192A; LEU185A; LYS188A; LYS196A
Human_RPS6,10,15,4,103.80040133333334,115.35,503.4471,0.6666666666666666,0.6,0.5333333333333333,ARG191A; HIS187A; LYS188A; VAL184A
Human_RPS6,8,25,8,-65.26480656,21.39546,313.5982,0.6,0.28,0.16,ARG131A; ARG140A; GLY134A; LEU133A; LEU144A; LYS136A; LYS143A; PRO135A
Human_RPS6,5,31,13,-44.82212290322581,21.87815,276.273,0.6774193548387096,0.2258064516129032,0.1612903225806451,ALA173A; ARG131A; ARG132A; ARG159A; GLY134A; LEU133A; LYS136A; LYS160A; LYS172A; PRO130A; PRO161A; PRO174A; VAL158A
